{
  "$schema": "../../../schema/character.schema.json",
  "schemaVersion": 1,
  "id": "rooster",
  "displayName": "Rooster",
  "description": "Loud, proud and punctual. Glides down from anywhere and crows at your alarms.",
  "sprite": {
    "type": "pixels",
    "scale": 3,
    "palette": {
      "k": "#2a2a2a",
      "w": "#fbfbf5",
      "b": "#a0522d",
      "n": "#e8a23a",
      "r": "#d7263d",
      "y": "#f2b705",
      "t": "#1f3d2b",
      "u": "#3f7a5a",
      "e": "#8a8a8a",
      "z": "#7aa7ff"
    },
    "frames": {
      "stand": [
        "..........rr....",
        ".........rrrr...",
        "..tt....kwwwwk..",
        ".tuut...kwwkwk..",
        "tu..ut..kwwwwkyy",
        "t...ut..kwwwrr..",
        "t..ut...knnnrr..",
        "..tut..knnnnk...",
        "..tt.kkwwnnwk...",
        "..tkkwwwwwwwwk..",
        "..kwwbbbbbwwwk..",
        "..kwwwbbbbwwwk..",
        "...kwwwwbbwwk...",
        "....kwwwwwwk....",
        ".....kkkkkk.....",
        "......y..y......",
        "......y..y......",
        ".....yy.yy......"
      ],
      "blink": [
        "..........rr....",
        ".........rrrr...",
        "..tt....kwwwwk..",
        ".tuut...kwwewk..",
        "tu..ut..kwwwwkyy",
        "t...ut..kwwwrr..",
        "t..ut...knnnrr..",
        "..tut..knnnnk...",
        "..tt.kkwwnnwk...",
        "..tkkwwwwwwwwk..",
        "..kwwbbbbbwwwk..",
        "..kwwwbbbbwwwk..",
        "...kwwwwbbwwk...",
        "....kwwwwwwk....",
        ".....kkkkkk.....",
        "......y..y......",
        "......y..y......",
        ".....yy.yy......"
      ],
      "walk1": [
        "..........rr....",
        ".........rrrr...",
        "..tt....kwwwwk..",
        ".tuut...kwwkwk..",
        "tu..ut..kwwwwkyy",
        "t...ut..kwwwrr..",
        "t..ut...knnnrr..",
        "..tut..knnnnk...",
        "..tt.kkwwnnwk...",
        "..tkkwwwwwwwwk..",
        "..kwwbbbbbwwwk..",
        "..kwwwbbbbwwwk..",
        "...kwwwwbbwwk...",
        "....kwwwwwwk....",
        ".....kkkkkk.....",
        ".....y....y.....",
        "....y......y....",
        "...yy......yy..."
      ],
      "walk2": [
        "...........rr...",
        "..........rrrr..",
        "..tt.....kwwwwk.",
        ".tuut....kwwkwk.",
        "tu..ut...kwwwwky",
        "t...ut...kwwwrr.",
        "t..ut....knnnrr.",
        "..tut...knnnnk..",
        "..tt.kkwwnnwk...",
        "..tkkwwwwwwwwk..",
        "..kwwbbbbbwwwk..",
        "..kwwwbbbbwwwk..",
        "...kwwwwbbwwk...",
        "....kwwwwwwk....",
        ".....kkkkkk.....",
        ".......yy.......",
        ".......yy.......",
        "......yyyy......"
      ],
      "run1": [
        "...........rr...",
        "..........rrrr..",
        "..tt.....kwwwwk.",
        ".tuut....kwwkwk.",
        "tu..ut...kwwwwky",
        "t...ut...kwwwrr.",
        "t..kbbbbbknnnrr.",
        "..tkbbbbbbknnk..",
        "..ttkbbbbknwk...",
        "..tkkwwwwwwwwk..",
        "..kwwbbbbbwwwk..",
        "..kwwwbbbbwwwk..",
        "...kwwwwbbwwk...",
        "....kwwwwwwk....",
        ".....kkkkkk.....",
        ".....y....y.....",
        "....y......y....",
        "...yy......yy..."
      ],
      "run2": [
        "...........rr...",
        "..........rrrr..",
        "..tt.....kwwwwk.",
        ".tuut....kwwkwk.",
        "tu..ut...kwwwwky",
        "t...ut...kwwwrr.",
        "t..ut....knnnrr.",
        "..tut...knnnnk..",
        "..tt.kkwwnnwk...",
        "..tkkwwwwwwwwk..",
        "..kwwbbbbbwwwk..",
        "..kkbbbbbkwwwk..",
        "..kbbbbbkbwwk...",
        "..kbbbkwwwwk....",
        "...kkkkkkkk.....",
        ".......yy.......",
        ".......yy.......",
        "......yyyy......"
      ],
      "jump": [
        "..........rr....",
        ".........rrrr...",
        "..tt....kwwwwk..",
        ".tuut...kwkkwk..",
        "tu..ut..kwwwwkyy",
        "t...ut..kwwwrr..",
        "t..ut...knnnrr..",
        "..tut..knnnnk...",
        "..tt.kkwwnnwk...",
        "..tkkwwwwwwwwk..",
        "..kwwbbbbbwwwk..",
        "..kkbbbbbkwwwk..",
        "..kbbbbbkbwwk...",
        "..kbbbkwwwwk....",
        "...kkkkkkkk.....",
        "......yy.yy.....",
        "................",
        "................"
      ],
      "fall": [
        "..........rr....",
        ".........rrrr...",
        "..tt....kwwwwk..",
        ".tuut...kwkkwkyy",
        "tu..ukbkkwwwwk..",
        "t...kbbbkwwwrryy",
        "t..kbbbbbknnrr..",
        "..tkbbbbbbknk...",
        "..ttkbbbbknwk...",
        "..tkkwwwwwwwwk..",
        "..kwwbbbbbwwwk..",
        "..kwwwbbbbwwwk..",
        "...kwwwwbbwwk...",
        "....kwwwwwwk....",
        ".....kkkkkk.....",
        ".....y....y.....",
        "....y......y....",
        "...yy......yy..."
      ],
      "land": [
        "..........rr....",
        ".........rrrr...",
        "..tt....kwwwwk..",
        ".tuut...kwwkwk..",
        "tu..ut..kwwwwkyy",
        "t...ut..kwwwrr..",
        "t..ut...knnnrr..",
        "..tut..knnnnk...",
        "..tt.kkwwnnwk...",
        "..tkkwwwwwwwwk..",
        "..kwwbbbbbwwwk..",
        "..kkbbbbbkwwwk..",
        "..kbbbbbkbwwk...",
        "..kbbbkwwwwk....",
        "...kkkkkkkk.....",
        ".......yy.......",
        ".......yy.......",
        "......yyyy......"
      ],
      "glide1": [
        "..........rr....",
        ".........rrrr...",
        "..tt....kwwwwk..",
        ".tuut...kwwkwk..",
        "tu..ukbkkwwwwkyy",
        "t...kbbbkwwwrr..",
        "t..kbbbbbknnrr..",
        "..tkbbbbbbknk...",
        "..ttkbbbbknwk...",
        "..tkkwwwwwwwwk..",
        "..kwwbbbbbwwwk..",
        "..kwwwbbbbwwwk..",
        "...kwwwwbbwwk...",
        "....kwwwwwwk....",
        ".....kkkkkk.....",
        "......yy.yy.....",
        "................",
        "................"
      ],
      "glide2": [
        "..........rr....",
        ".........rrrr...",
        "..tt....kwwwwk..",
        ".tuut...kwwkwk..",
        "tu..ut..kwwwwkyy",
        "t...ut..kwwwrr..",
        "t..ut...knnnrr..",
        "..tut..knnnnk...",
        "..tt.kkwwnnwk...",
        "..tkkwwwwwwwwk..",
        "..kwwbbbbbwwwk..",
        "..kkbbbbbkwwwk..",
        "..kbbbbbkbwwk...",
        "..kbbbkwwwwk....",
        "...kkkkkkkk.....",
        "......yy.yy.....",
        "................",
        "................"
      ],
      "crow1": [
        "...........rr..r",
        "..........rrrr..",
        "..tt.....kwwwwk.",
        ".tuut....kwwkwky",
        "tu..ut...kwwwwk.",
        "t...ut...kwwwrry",
        "t..ut....knnnrr.",
        "..tut...knnnnk..",
        "..tt.kkwwnnwk...",
        "..tkkwwwwwwwwk..",
        "..kwwbbbbbwwwk..",
        "..kwwwbbbbwwwk..",
        "...kwwwwbbwwk...",
        "....kwwwwwwk....",
        ".....kkkkkk.....",
        "......y..y......",
        "......y..y......",
        ".....yy.yy......"
      ],
      "crow2": [
        "...........rr.r.",
        "..........rrrr.r",
        "..tt.....kwwwwk.",
        ".tuut....kwwkwky",
        "tu..ut...kwwwwk.",
        "t...ut...kwwwrry",
        "t..ut....knnnrr.",
        "..tut...knnnnk..",
        "..tt.kkwwnnwk...",
        "..tkkwwwwwwwwk..",
        "..kwwbbbbbwwwk..",
        "..kwwwbbbbwwwk..",
        "...kwwwwbbwwk...",
        "....kwwwwwwk....",
        ".....kkkkkk.....",
        "......y..y......",
        "......y..y......",
        ".....yy.yy......"
      ],
      "alert": [
        "..........rr...r",
        ".........rrrr..r",
        "..tt....kwwwwk..",
        ".tuut...kwkkwk.r",
        "tu..ut..kwwwwkyy",
        "t...ut..kwwwrr..",
        "t..ut...knnnrr..",
        "..tut..knnnnk...",
        "..tt.kkwwnnwk...",
        "..tkkwwwwwwwwk..",
        "..kwwbbbbbwwwk..",
        "..kwwwbbbbwwwk..",
        "...kwwwwbbwwk...",
        "....kwwwwwwk....",
        ".....kkkkkk.....",
        "......y..y......",
        "......y..y......",
        ".....yy.yy......"
      ],
      "peck1": [
        "................",
        "................",
        "..tt............",
        ".tuut......rr...",
        "tu..ut....rrrr..",
        "t...ut...kwwwwk.",
        "t..ut....kwwkwk.",
        "..tut....kwwwwky",
        "..tt.kkwwkwwwrr.",
        "..tkkwwwwknnnrr.",
        "..kwwbbbknnnnk..",
        "..kwwwbbbbwwwk..",
        "...kwwwwbbwwk...",
        "....kwwwwwwk....",
        ".....kkkkkk.....",
        "......y..y......",
        "......y..y......",
        ".....yy.yy......"
      ],
      "peck2": [
        "................",
        "................",
        "..tt............",
        ".tuut...........",
        "tu..ut..........",
        "t...ut..........",
        "t..ut......rr...",
        "..tut.....rrrr..",
        "..tt.kkwwkwwwwk.",
        "..tkkwwwwkwwkwk.",
        "..kwwbbbbkwwwwky",
        "..kwwwbbbkwwwrr.",
        "...kwwwwbknnnrr.",
        "....kwwwknnnnk..",
        ".....kkkkkk.....",
        "......y..y......",
        "......y..y......",
        ".....yy.yy......"
      ],
      "kick": [
        "..........rr....",
        ".........rrrr...",
        "..tt....kwwwwk..",
        ".tuut...kwwkwk..",
        "tu..ut..kwwwwkyy",
        "t...ut..kwwwrr..",
        "t..ut...knnnrr..",
        "..tut..knnnnk...",
        "..tt.kkwwnnwk...",
        "..tkkwwwwwwwwk..",
        "..kwwbbbbbwwwk..",
        "..kwwwbbbbwwwk..",
        "...kwwwwbbwwk...",
        "....kwwwwwwk....",
        ".....kkkkkk.yy..",
        ".....y....yyy...",
        "....y......y....",
        "...yy......yy..."
      ],
      "sit": [
        "................",
        "................",
        "..........rr....",
        ".........rrrr...",
        "..tt....kwwwwk..",
        ".tuut...kwwkwk..",
        "tu..ut..kwwwwkyy",
        "t...ut..kwwwrr..",
        "t..ut...knnnrr..",
        "..tut..knnnnk...",
        "..tt.kkwwnnwk...",
        "..tkkwwwwwwwwk..",
        "..kwwbbbbbwwwk..",
        "..kwwwbbbbwwwk..",
        "...kwwwwbbwwk...",
        "....kwwwwwwk....",